앱이름,유저이름,리뷰날짜,평점,리뷰의 좋아요 개수,리뷰 내용,전처리1,spell_check
당근마켓,문만주,2021년 12월 24일,5,,중고 물품 싸게 바로 구입할수있어서 너무좋네요 지역등록해야 볼수있어서 그건 좀불편하네요.,중고 물품 싸게 바로 구입할수있어서 너무좋네요 지역등록해야 볼수있어서 그건 좀불편하네요,중고 물품 싸게 바로 구입할 수 있어서 너무 좋네요 지역 등록해야 볼 수 있어서 그건 좀 불편하네요
당근마켓,jiheebbogle,2022년 2월 2일,5,,거래하기에 좋은것 같아요 그런데 다른사람 프로필에 들어가서 약간 DM처럼 문자할수 있게 만들어주시면 좋을것 같아요!!,거래하기에 좋은것 같아요 그런데 다른사람 프로필에 들어가서 약간 DM처럼 문자할수 있게 만들어주시면 좋을것 같아요 ,거래하기에 좋은 것 같아요 그런데 다른 사람 프로필에 들어가서 약간 DM처럼 문자 할 수 있게 만들어주시면 좋을 것 같아요 
당근마켓,김묘경,2022년 1월 4일,3,21.0,"인증번호가 안 와서 문의드립니다... 다시 깔아 보고, 인증문자 다시 보내기를 몇 번씩 눌러보고 기다려도 인증문자가 오질 않습니다.. 그리고 전 이 앱을 처음 사용해서 이메일 인증 등도 불가하고요 빠른시일내에 답변 부탁드리겠습니다....",인증번호가 안 와서 문의드립니다 다시 깔아 보고 인증문자 다시 보내기를 몇 번씩 눌러보고 기다려도 인증문자가 오질 않습니다 그리고 전 이 앱을 처음 사용해서 이메일 인증 등도 불가하고요 빠른시일내에 답변 부탁드리겠습니다,인증번호가 안 와서 문의드립니다 다시 깔아 보고 인증 문자 다시 보내기를 몇 번씩 눌러보고 기다려도 인증 문자가 오질 않습니다 그리고 전 이 앱을 처음 사용해서 이메일 인증 등도 불가하고요 빠른 시일 내에 답변 부탁드리겠습니다
당근마켓,권윤찬,2022년 1월 18일,5,,나한테 필요한 물건 적절한 가격으로 구입해서 좋고 나한테 불필요한데 필요한 분에게 적절한 가격 또는 나눔해서 좋아요~*^---^*,나한테 필요한 물건 적절한 가격으로 구입해서 좋고 나한테 불필요한데 필요한 분에게 적절한 가격 또는 나눔해서 좋아요 ,나한테 필요한 물건 적절한 가격으로 구입해서 좋고 나한테 불필요한데 필요한 분에게 적절한 가격 또는 나눔 해서 좋아요 
당근마켓,김순옥,2022년 2월 5일,5,,거래하고있는모든분들이 친절하시고상품도 만족하고있어요. 역쉬당근마켓입니다^^,거래하고있는모든분들이 친절하시고상품도 만족하고있어요 역쉬당근마켓입니다 ,거래하고 있는 모든 분들이 친절하시고 상품도 만족하고 있어요 역시 당근 마켓입니다
당근마켓,김애란,2022년 1월 27일,5,,"당근마켓을 통한 거래가 처음이었지만,쉽게 적응할 수 있게 앱이 잘 되어 있습니다.",당근마켓을 통한 거래가 처음이었지만 쉽게 적응할 수 있게 앱이 잘 되어 있습니다,당근 마켓을 통한 거래가 처음이었지만 쉽게 적응할 수 있게 앱이 잘 되어 있습니다
당근마켓,두비두밥,2021년 12월 24일,5,,너무너무 좋아요.내가 정리하고 싶었던 물건들을 하나하나씩 팔고 돈을 받으니 정말 기분이 좋더라고요*^-^*,너무너무 좋아요 내가 정리하고 싶었던 물건들을 하나하나씩 팔고 돈을 받으니 정말 기분이 좋더라고요 ,너무너무 좋아요 내가 정리하고 싶었던 물건들을 하나하나씩 팔고 돈을 받으니 정말 기분이 좋더라고요 
당근마켓,모탈,2021년 12월 18일,5,,너무 좋아요 그런데 챗이안보일때가 있어요 ㅠㄷㅠ 그럴때마다 나갔다 들어와야해서 불편해요 ㅠ 그것만 빼면 개이득이에요!,너무 좋아요 그런데 챗이안보일때가 있어요 그럴때마다 나갔다 들어와야해서 불편해요 그것만 빼면 개이득이에요 ,너무 좋아요 그런데 챗이 안 보일 때가 있어요 그럴 때마다 나갔다 들어와야 해서 불편해요 그것만 빼면 개이득이에요 
당근마켓,JIHYUN YU,2022년 2월 6일,4,,삼섬갤럭지플립3 쓰는데 최근에업데이트하고 화면안뜨면서 멈추는현상이계속생기네요ㅜ수정좀해주세요,삼섬갤럭지플립 쓰는데 최근에업데이트하고 화면안뜨면서 멈추는현상이계속생기네요 수정좀해주세요,삼섬갤럭지플립 쓰는데 최근에 업데이트하고 화면 안 뜨면서 멈추는 현상이 계속 생기네요 수정 좀 해주세요
당근마켓,문서현,2022년 2월 8일,5,,따뜻한 이웃과 공감하며 대화하는게 시간이 잘 가고!싼 금액에 상태가 좋은 물건을 가지게 되었어요! 고마워요!당근🥕,따뜻한 이웃과 공감하며 대화하는게 시간이 잘 가고 싼 금액에 상태가 좋은 물건을 가지게 되었어요 고마워요 당근 ,따뜻한 이웃과 공감하며 대화하는 게 시간이 잘 가고 싼 금액에 상태가 좋은 물건을 가지게 되었어요 고마워요 당근 
당근마켓,이순성,2022년 2월 18일,1,7.0,아니 지금 거래중인데 서버점검을 정해진시간 없이 하면 어쩌라는거에요??? 지금 거래하시는분 시간 맞춰놓고 근처위치 왔는데 서로 정확히 어디있는지 몰라서 30분째 손가락만 빨고 기다리고 있어요. 더 기다려야 할거같아요. 진짜 열받네요. 이런식 운영은요,아니 지금 거래중인데 서버점검을 정해진시간 없이 하면 어쩌라는거에요 지금 거래하시는분 시간 맞춰놓고 근처위치 왔는데 서로 정확히 어디있는지 몰라서 분째 손가락만 빨고 기다리고 있어요 더 기다려야 할거같아요 진짜 열받네요 이런식 운영은요,아니 지금 거래 중인데 서버 점검을 정해진 시간 없이 하면 어쩌라는 거예요 지금 거래하시는 분 시간 맞춰놓고 근처 위치 왔는데 서로 정확히 어디 있는지 몰라서 분재 손가락만 빨고 기다리고 있어요 더 기다려야 할 거 같아요 진짜 열받네요 이런 식 운영은요
당근마켓,박준영,2022년 2월 3일,5,,너무 좋아요 일단 상대방이랑 직거래를안전하게 할수있어좋고 광고도 없고 가격조절도 자유자재로 할수있어 오히려 재밌어요,너무 좋아요 일단 상대방이랑 직거래를안전하게 할수있어좋고 광고도 없고 가격조절도 자유자재로 할수있어 오히려 재밌어요,너무 좋아요 일단 상대방이랑 직거래를 안전하게 할 수 있어 좋고 광고도 없고 가격 조절도 자유자재로 할 수 있어 오히려 재밌어요
당근마켓,_유자차,2022년 1월 29일,4,,그냥 가끔 구경하다 이것도 있나 하고 찾아보기도 좋네요ㅋㅋ 가끔 거래 성공하면 기분 좋구 필요한것도 싸게사소 조아욥,그냥 가끔 구경하다 이것도 있나 하고 찾아보기도 좋네요 가끔 거래 성공하면 기분 좋구 필요한것도 싸게사소 조아욥,그냥 가끔 구경하다 이것도 있나 하고 찾아보기도 좋네요 가끔 거래 성공하면 기분 좋고 필요한 것도 싸게 사소 조아욥
당근마켓,김고구마,2022년 2월 9일,5,,만족하며 사용중. 판매자가 택배 가능으로 기재한 품목은 지역 상관없이 볼 수 있다면 더 좋겠습니다.,만족하며 사용중 판매자가 택배 가능으로 기재한 품목은 지역 상관없이 볼 수 있다면 더 좋겠습니다,만족하며 사용 중 판매자가 택배 가능으로 기재한 품목은 지역 상관없이 볼 수 있다면 더 좋겠습니다
당근마켓,Ble Lue,2022년 2월 18일,4,2.0,다 좋은데 서버관리좀요.....제발 거래 하다가 계속 챗이 안보내져서 삭제 했다가 다시 로그인 할려니까 안됨;;,다 좋은데 서버관리좀요 제발 거래 하다가 계속 챗이 안보내져서 삭제 했다가 다시 로그인 할려니까 안됨 ,다 좋은데 서버 관리 좀 요 제발 거래하다가 계속 챗이 안 보내져서 삭제했다가 다시 로그인하려니까 안됨 
당근마켓,미래를읽는남자,2022년 1월 3일,5,,당근마켓을 이용하니 생활이 너무. 편리해졌습니다. 좋은상태의 물건을 동네주민들과 교환하니 너무 좋습니다,당근마켓을 이용하니 생활이 너무 편리해졌습니다 좋은상태의 물건을 동네주민들과 교환하니 너무 좋습니다,당근 마켓을 이용하니 생활이 너무 편리해졌습니다 좋은 상태의 물건을 동네 주민들과 교환하니 너무 좋습니다
당근마켓,성승원,2022년 1월 31일,5,,사용하지 않는 물건을 팔기도 하고 나눔을 하면서 돈도 벌고 정도 나누고 물건 정리로 하고 정말 좋습니다^^,사용하지 않는 물건을 팔기도 하고 나눔을 하면서 돈도 벌고 정도 나누고 물건 정리로 하고 정말 좋습니다 ,사용하지 않는 물건을 팔기도 하고 나눔을 하면서 돈도 벌고 정도 나누고 물건 정리로 하고 정말 좋습니다 
당근마켓,윤지원,2021년 12월 25일,4,,다른건 매우 만족합니다 그런데 가꾸 검색필터가 초기화 돼네요 고쳐주셨으면 합니다,다른건 매우 만족합니다 그런데 가꾸 검색필터가 초기화 돼네요 고쳐주셨으면 합니다,다른 건 매우 만족합니다 그런데 자꾸 검색 필터가 초기화되네요 고쳐주셨으면 합니다
당근마켓,멋진사나이,2021년 12월 20일,5,,긴가민가 했는데 막상 해보니까 너무좋고... 중독성이 심하네요 집에 남아날 물건이 없을듯ㅎㅎ,긴가민가 했는데 막상 해보니까 너무좋고 중독성이 심하네요 집에 남아날 물건이 없을듯 ,긴가민가 했는데 막상 해보니까 너무 좋고 중독성이 심하네요 집에 남아날 물건이 없을 듯
당근마켓,서영비,2022년 2월 1일,5,4.0,"잘 사용하고 있습니다! 모처럼 신년이니 작은 의견을 내보려 합니당 번*장터처럼 나의 판매상품에 찜 하신 분이 누구인지 알 수 있고, 그분과 채팅을 할 수 있게 하는 기능이 추가되었으면 좋겠습니다!! 새해 복 많이 받으세요",잘 사용하고 있습니다 모처럼 신년이니 작은 의견을 내보려 합니당 번 장터처럼 나의 판매상품에 찜 하신 분이 누구인지 알 수 있고 그분과 채팅을 할 수 있게 하는 기능이 추가되었으면 좋겠습니다 새해 복 많이 받으세요,잘 사용하고 있습니다 모처럼 신년이니 작은 의견을 내보려 합니다 번 장터처럼 나의 판매 상품에 찜 하신 분이 누구인지 알 수 있고 그분과 채팅을 할 수 있게 하는 기능이 추가되었으면 좋겠습니다 새해 복 많이 받으세요
당근마켓,박종덕,2022년 1월 27일,5,1.0,채팅 알람이 않울립니다. 설정을 껐다가 켰다가 해봐도 않돼네요.,채팅 알람이 않울립니다 설정을 껐다가 켰다가 해봐도 않돼네요,채팅 알람이 안 울립니다 설정을 껐다가 켰다가 해봐도 안되네요
당근마켓,이젠나도있지고양,2020년 8월 26일,3,,"좋아요. 단지 사람이 많이 사는 곳이 아니라서 거래량이 많지는 않지만, 업자가득한 중고나라보단 싸요. 라고 썻었는데, 우리동네 생기면서 업자가 늘었네요.ㅋㅋ 수익모델 창출에 힘쓰는 건 알겠는데,본업인 중고거래는 신경쓰셔아죠. 카테고리 검색을 귀찮게 만들면 누가 당근마켓쓸까요?.",좋아요 단지 사람이 많이 사는 곳이 아니라서 거래량이 많지는 않지만 업자가득한 중고나라보단 싸요 라고 썻었는데 우리동네 생기면서 업자가 늘었네요 수익모델 창출에 힘쓰는 건 알겠는데 본업인 중고거래는 신경쓰셔아죠 카테고리 검색을 귀찮게 만들면 누가 당근마켓쓸까요 ,좋아요 단지 사람이 많이 사는 곳이 아니라서 거래량이 많지는 않지만 업자 가득한 중고나라보단 사요라고 썼었는데 우리 동네 생기면서 업자가 늘었네요 수익모델 창출에 힘쓰는 건 알겠는데 본업인 중고거래는 신경 쓰셔야죠 카테고리 검색을 귀찮게 만들면 누가 당근 마켓 쓸까요
당근마켓,Jaeha Kim,2019년 6월 3일,1,42.0,개인광고보다 사기꾼 같은 업자들 광고가 훨씬 많아요. 회사도 유료사용자와 무료사용자 차별도 심하구요. 너무 상업적이에요. 그리고 막상 유료광고 해봐도 효과 없어요. 또 불편한 것 말하고 싶어도 콜센터도 없어요. 고객보다는 자기회사가 우선인 것 같아요. 이런 회사가 잘되면 이상한거겠죠,개인광고보다 사기꾼 같은 업자들 광고가 훨씬 많아요 회사도 유료사용자와 무료사용자 차별도 심하구요 너무 상업적이에요 그리고 막상 유료광고 해봐도 효과 없어요 또 불편한 것 말하고 싶어도 콜센터도 없어요 고객보다는 자기회사가 우선인 것 같아요 이런 회사가 잘되면 이상한거겠죠,개인 광고보다 사기꾼 같은 업자들 광고가 훨씬 많아요 회사도 유료 사용자와 무료 사용자 차별도 심하고요 너무 상업적이에요 그리고 막상 유료 광고해봐도 효과 없어요 또 불편한 것 말하고 싶어도 콜센터도 없어요 고객보다는 자기 회사가 우선인 것 같아요 이런 회사가 잘되면 이상한 거겠죠
당근마켓,희둥이hyidungi,2021년 10월 7일,1,13.0,"가입 중인데 닉네임 입력하려니까 ""일시적인 오류가 발생했어요. 잠시 후 다시 시도해주세요"" 라는 알림이 떠서 뒤로가기 누르니 가입 중에는 뒤로 갈 수 없다네요. 어떻게 가입하죠? ☞ 프로필 사진을 먼저 설정하고 닉네임을 작성해야 하네요. 순서 상관없이 설정할 수 있도록 하면 더욱 편리할 것 같습니다.",가입 중인데 닉네임 입력하려니까 일시적인 오류가 발생했어요 잠시 후 다시 시도해주세요 라는 알림이 떠서 뒤로가기 누르니 가입 중에는 뒤로 갈 수 없다네요 어떻게 가입하죠 프로필 사진을 먼저 설정하고 닉네임을 작성해야 하네요 순서 상관없이 설정할 수 있도록 하면 더욱 편리할 것 같습니다,가입 중인데 닉네임 입력하려니까 일시적인 오류가 발생했어요 잠시 후 다시 시도해주세요라는 알림이 떠서 뒤로 가기 누르니 가입 중에는 뒤로 갈 수 없다네요 어떻게 가입하죠 프로필 사진을 먼저 설정하고 닉네임을 작성해야 하네요 순서 상관없이 설정할 수 있도록 하면 더욱 편리할 것 같습니다
당근마켓,Pt O,2022년 4월 25일,5,,당근 빠르고 최고 좋음 근데 장사꾼이 너무많음,당근 빠르고 최고 좋음 근데 장사꾼이 너무많음,당근 빠르고 최고 좋음 근데 장사꾼이 너무 많음
당근마켓,이재빈,2020년 7월 11일,5,24.0,"정말 너무 좋아요! 수정할게 거의 없을 정도로 좋아요 ㅜㅜ 예를 들어 가격을 쉽게 볼 수 있고, 매너를 볼수도 있고, 몇명이 관심을 가졌는지, 또 몇명이 채팅을 했는지 알 수 있어서 너무 좋습니다..ㅜㅜ",정말 너무 좋아요 수정할게 거의 없을 정도로 좋아요 예를 들어 가격을 쉽게 볼 수 있고 매너를 볼수도 있고 몇명이 관심을 가졌는지 또 몇명이 채팅을 했는지 알 수 있어서 너무 좋습니다 ,정말 너무 좋아요 수정할게 거의 없을 정도로 좋아요 예를 들어 가격을 쉽게 볼 수 있고 매너를 볼 수도 있고 몇 명이 관심을 가졌는지 또 몇 명이 채팅을 했는지 알 수 있어서 너무 좋습니다 
당근마켓,Kuro Manju,2022년 1월 26일,1,2.0,아니 동네인증 계속하라고 떠요; 완료하고 바로 하트눌러봐도 다시 인증하라고 뜨고;; 그렇다고 다른동네 와있는것도 아니구만,아니 동네인증 계속하라고 떠요 완료하고 바로 하트눌러봐도 다시 인증하라고 뜨고 그렇다고 다른동네 와있는것도 아니구만,아니 동네 인증 계속하라고 떠요 완료하고 바로 하트 눌러봐도 다시 인증하라고 뜨고 그렇다고 다른 동네 와있는 것도 아니구먼
당근마켓,박효경,2020년 9월 4일,5,,"가입해 놓고 한참만에 당근홀릭 ~~~** 주변에서 중독되었다고 .ㅎㅎ 제가 섬기는 사무실이 이전하여 필요물건이 많았는데 싸게 구입할수있어서 감사하고. 수줍게 ""당근""하고 신호를 보내시는 아주머니를 보면서 흐뭇한마음으로 물건을 받아와서 잘쓰게되었다.광고도 별로 없는 당근마켓 플랫폼은 중고물품을 서비스하면서. 무엇으로 돈을벌지? 궁금 해지는 순간이다. 고마움을전해보면서",가입해 놓고 한참만에 당근홀릭 주변에서 중독되었다고 제가 섬기는 사무실이 이전하여 필요물건이 많았는데 싸게 구입할수있어서 감사하고 수줍게 당근 하고 신호를 보내시는 아주머니를 보면서 흐뭇한마음으로 물건을 받아와서 잘쓰게되었다 광고도 별로 없는 당근마켓 플랫폼은 중고물품을 서비스하면서 무엇으로 돈을벌지 궁금 해지는 순간이다 고마움을전해보면서,가입해 놓고 한참만에 당근 홀릭 주변에서 중독되었다고 제가 섬기는 사무실이 이전하여 필요 물건이 많았는데 싸게 구입할 수 있어서 감사하고 수줍게 당근 하고 신호를 보내시는 아주머니를 보면서 흐뭇한 마음으로 물건을 받아와서 잘 쓰게 되었다 광고도 별로 없는 당근 마켓 플랫폼은 중고물품을 서비스하면서 무엇으로 돈을 벌지 궁금 해지는 순간이다 고마움을 전해보면서
당근마켓,차릴리,2022년 2월 3일,3,,당근 제작자님 제발 봐주세요.. 제가 7000원을 사기 당했는데 폰이 망가져서 새로 폰을 사서 사진이나 이런게 없어서 신고도 못하고 있는 상황입니다.. 어떻게 해야하나요? 그래도 이용할땐 좋았어서 3점 남깁니다.,당근 제작자님 제발 봐주세요 제가 원을 사기 당했는데 폰이 망가져서 새로 폰을 사서 사진이나 이런게 없어서 신고도 못하고 있는 상황입니다 어떻게 해야하나요 그래도 이용할땐 좋았어서 점 남깁니다,당근 제작자님 제발 봐주세요 제가 원을 사기당했는데 폰이 망가져서 새로 폰을 사서 사진이나 이런 게 없어서 신고도 못하고 있는 상황입니다 어떻게 해야 하나요 그래도 이용할 땐 좋아서 점 남깁니다
당근마켓,체다덮밥,2022년 2월 19일,5,1.0,채팅방을 한꺼번에 삭제할 수 있게 해주세요! 대화가 너무 많이 생성되있어서 지울수가 없네요ㅠ,채팅방을 한꺼번에 삭제할 수 있게 해주세요 대화가 너무 많이 생성되있어서 지울수가 없네요 ,채팅방을 한꺼번에 삭제할 수 있게 해주세요 대화가 너무 많이 생성돼있어서 지울 수가 없네요 
당근마켓,단밤,2021년 12월 6일,5,,"판매자, 구매자분들이 모두 착하시고 가격도 저렴하게 팔아서 좋은것 같아요(*´ ˘ `*)",판매자 구매자분들이 모두 착하시고 가격도 저렴하게 팔아서 좋은것 같아요 ,판매자 구매자분들이 모두 착하시고 가격도 저렴하게 팔아서 좋은 것 같아요 
당근마켓,배재영,2020년 6월 11일,4,1.0,다 좋은데 검색 필터 정확도 말고 최신으로 적용하면 계속 그대로 유지됐으면 좋겠어요. 검색 할때마다 정말 너무너무 불편합니다ㅠ설정에도 따로 없고요..,다 좋은데 검색 필터 정확도 말고 최신으로 적용하면 계속 그대로 유지됐으면 좋겠어요 검색 할때마다 정말 너무너무 불편합니다 설정에도 따로 없고요,다 좋은데 검색 필터 정확도 말고 최신으로 적용하면 계속 그대로 유지됐으면 좋겠어요 검색할 때마다 정말 너무너무 불편합니다 설정에도 따로 없고요
당근마켓,윤혜선,2022년 2월 8일,1,,물건판매글을올릴려했더니 다른지역의 글을 거래완료 또는 숨김처리하고만 계속 뜨네요 에초에 전 다른구에서는 올리지도 안았는데...,물건판매글을올릴려했더니 다른지역의 글을 거래완료 또는 숨김처리하고만 계속 뜨네요 에초에 전 다른구에서는 올리지도 안았는데,물건 판매 글을 올리려 했더니 다른 지역의 글을 거래 완료 또는 숨김 처리하고 만 계속 뜨네요 애초에 전 다른 구에서는 올리지도 않았는데
당근마켓,김성훈,2020년 6월 22일,1,,다른 동네는 체팅도 관심도 못하게 하면서 키워드 울림을 울리고 막상체팅 할려면 동네가 틀리다고 연락도 못하게 하는건 뭔지모르겠네요?그럴거면 동네거만 불리해서 올려주던지 그런 기술 없음 사고 팔기를 다 하게 해주던지 그래야지 필요한 물건 있는데 사하구에서 해운대 있는 물건은 못사게 하는게 하는건 아니자나요 급한사람이 찾아가서 직거래 할수있는거 아닌가요? 수정좀 부탁합니다,다른 동네는 체팅도 관심도 못하게 하면서 키워드 울림을 울리고 막상체팅 할려면 동네가 틀리다고 연락도 못하게 하는건 뭔지모르겠네요 그럴거면 동네거만 불리해서 올려주던지 그런 기술 없음 사고 팔기를 다 하게 해주던지 그래야지 필요한 물건 있는데 사하구에서 해운대 있는 물건은 못사게 하는게 하는건 아니자나요 급한사람이 찾아가서 직거래 할수있는거 아닌가요 수정좀 부탁합니다,다른 동네는 채팅도 관심도 못하게 하면서 키워드 울림을 울리고 막상 채팅 하려면 동네가 틀리다고 연락도 못하게 하는 건 뭔지 모르겠네요 그럴 거면 동네 거만 불리해서 올려주던지 그런 기술 없음 사고팔기를 다 하게 해주던지 그래야지 필요한 물건 있는데 사하구에서 해운대 있는 물건은 못 사게 하는 게 하는 건 아니잖아요 급한 사람이 찾아가서 직거래 할 수 있는 거 아닌가요 수정 좀 부탁합니다
당근마켓,zip code,2022년 4월 27일,1,5.0,비정상적인 인증시도는 뭐야...로그인이 안되네,비정상적인 인증시도는 뭐야 로그인이 안되네,비정상적인 인증 시도는 뭐야 로그인이 안 되네
당근마켓,박흥수,2022년 2월 18일,1,1.0,글올려놓고들어가는데 계속 오류뜨고넘어가지지도않습니다 이거 폰껏다키고해도그런데왜그런가요,글올려놓고들어가는데 계속 오류뜨고넘어가지지도않습니다 이거 폰껏다키고해도그런데왜그런가요,글 올려놓고 들어가는데 계속 오류 뜨고 넘어가지지도 않습니다 이거 폰 껐다 키고 해도 그런데 왜 그런가요
당근마켓,장영재,2020년 9월 19일,3,1.0,2020/09/19 채팅이 제시각에 보내지지 않는 것 같습니다. 채팅 서버에 접속이 빈번히 안 됩니다. 확인 부탁드립니다. 2019/11/15 경 일시적 서버 오류가 있었으나 몇 시간 안 되어서 바로 복구됨. 앱 유지보수 측면에서 열일하시는 걸 알 수 있었습니다., 채팅이 제시각에 보내지지 않는 것 같습니다 채팅 서버에 접속이 빈번히 안 됩니다 확인 부탁드립니다 경 일시적 서버 오류가 있었으나 몇 시간 안 되어서 바로 복구됨 앱 유지보수 측면에서 열일하시는 걸 알 수 있었습니다, 채팅이 제시간에 보내지지 않는 것 같습니다 채팅 서버에 접속이 빈번히 안 됩니다 확인 부탁드립니다 경 일시적 서버 오류가 있었으나 몇 시간 안 되어서 바로 복구됨 앱 유지 보수 측면에서 열 일하시는 걸 알 수 있었습니다
당근마켓,땡모땡모,2022년 2월 12일,5,,당근마켓사용하고싶어서 설치했는데 휴대폰번호 인증하려고 했는데 인증문자가 않옵니다 이럴경우는 어떻게조치해야되는지 답변부탁드립니다,당근마켓사용하고싶어서 설치했는데 휴대폰번호 인증하려고 했는데 인증문자가 않옵니다 이럴경우는 어떻게조치해야되는지 답변부탁드립니다,당근 마켓 사용하고 싶어서 설치했는데 휴대폰 번호 인증하려고 했는데 인증 문자가 안 옵니다 이럴 경우는 어떻게 조치해야 되는지 답변 부탁드립니다
