앱이름,유저이름,리뷰날짜,평점,리뷰의 좋아요 개수,리뷰 내용,전처리1,spell_check
당근마켓,홍우상,2022년 4월 11일,1,1.0,지방인경우 너무힘드네요 물건이없어서 옆동네로 위치설정후 검색하면 있어서 거래할려고해도방법이없네요 쪽지도못보내구요 지방에서 10~20km거리라도 차로 15분도안걸립니다 근데연락해볼방법이없는건 너무한거같습니다,지방인경우 너무힘드네요 물건이없어서 옆동네로 위치설정후 검색하면 있어서 거래할려고해도방법이없네요 쪽지도못보내구요 지방에서 km거리라도 차로 분도안걸립니다 근데연락해볼방법이없는건 너무한거같습니다,지방인 경우 너무 힘드네요 물건이 없어서 옆 동네로 위치 설정 후 검색하면 있어서 거래하려고 해도 방법이 없네요 쪽지도 못 보내고요 지방에서 km 거리라도 차로 분도 안 걸립니다 근데 연락해볼 방법이 없는 건 너무한 거 같습니다
당근마켓,정동현,2022년 4월 26일,5,,처음 해보는 중고거래여서 많이 긴장되긴했는데 이것만큼 믿고 쓸만한게 없네요,처음 해보는 중고거래여서 많이 긴장되긴했는데 이것만큼 믿고 쓸만한게 없네요,처음 해보는 중고거래여서 많이 긴장되긴 했는데 이것만큼 믿고 쓸만한 게 없네요
당근마켓,윤서아빠,2022년 3월 22일,1,1.0,인증문자 받아서 가입단계에서 뒤로가기도 앞으로 가기도 안되는데 어딜가서 확인하라는거예요 ㅡㅡ 관리자가 당근 쓰기는하는거임??,인증문자 받아서 가입단계에서 뒤로가기도 앞으로 가기도 안되는데 어딜가서 확인하라는거예요 관리자가 당근 쓰기는하는거임 ,인증 문자 받아서 가입단계에서 뒤로 가기도 앞으로 가기도 안되는데 어딜 가서 확인하라는 거예요 관리자가 당근 쓰기는 하는 거임
당근마켓,예병찬,2021년 6월 7일,4,,"아이가 소중히 여기던 물건이, 이제는 다른사람에게도 도움을 줄수 있다는걸 가르쳐주는 거래가 되었어요. 다만, 판매물품 등록후, 구매자께서 채팅으로 무언가를 남기고 서로 연락하는 과정에서, (제가 아직 잘 모르는건지, 세팅이 잘못된건지..) 글을 작성하면 앱을 실행하지 않았더라도 상대에게 적극 전달되면 더 원활한 커뮤니케이션이 되고, 속도가 높아져 거래시간을 줄일수 있을것 같아요~",아이가 소중히 여기던 물건이 이제는 다른사람에게도 도움을 줄수 있다는걸 가르쳐주는 거래가 되었어요 다만 판매물품 등록후 구매자께서 채팅으로 무언가를 남기고 서로 연락하는 과정에서 제가 아직 잘 모르는건지 세팅이 잘못된건지 글을 작성하면 앱을 실행하지 않았더라도 상대에게 적극 전달되면 더 원활한 커뮤니케이션이 되고 속도가 높아져 거래시간을 줄일수 있을것 같아요 ,아이가 소중히 여기던 물건이 이제는 다른 사람에게도 도움을 줄 수 있다는 걸 가르쳐주는 거래가 되었어요 다만 판매 물품 등록 후 구매자께서 채팅으로 무언가를 남기고 서로 연락하는 과정에서 제가 아직 잘 모르는 건지 세팅이 잘못된 건지 글을 작성하면 앱을 실행하지 않았더라도 상대에게 적극 전달되면 더 원활한 커뮤니케이션이 되고 속도가 높아져 거래시간을 줄일 수 있을 것 같아요 
당근마켓,나다,2021년 6월 28일,5,,혹시 채팅방 이름 수정기능추가가 가능할까요?? 동시에 여러사람과 거래약속을 맺기로할때가많은데 이름옆에 거래금액을 써둔다던가 직거래장소같은것들을 메모해두고싶어서용....중요채팅방으로 표시만으로는 정확한 정보를 확인하기위해서 채팅내역을 계속 찾아봐야하는 번거로움이 있거든요... 나머지는 좋아용😃,혹시 채팅방 이름 수정기능추가가 가능할까요 동시에 여러사람과 거래약속을 맺기로할때가많은데 이름옆에 거래금액을 써둔다던가 직거래장소같은것들을 메모해두고싶어서용 중요채팅방으로 표시만으로는 정확한 정보를 확인하기위해서 채팅내역을 계속 찾아봐야하는 번거로움이 있거든요 나머지는 좋아용 ,혹시 채팅방 이름 수정 기능 추가가 가능할까요 동시에 여러 사람과 거래 약속을 맺기로 할 때가 많은데 이름 옆에 거래금액을 써둔다던가 질 거래 장소 같은 것들을 메모해두고 싶어서요 중요 채팅방으로 표시만으로는 정확한 정보를 확인하기 위해서 채팅 내역을 계속 찾아봐야 하는 번거로움이 있거든요 나머지는 좋아요
당근마켓,정우석,2020년 5월 12일,5,123.0,지역마켓의 취지는 알겠는데 타지역의 채팅창이 활성화안돼서 아쉽습니다. 정말 필요한 물건이 내지역외에 있는경우가 많은데 그럴경우 타지역으로 가서라도 구매해야 하는 경우가 있그덩요! 개인적으로 이번 쇼파 구매의 경우도 제 지역에 없어서 부모님댁에 왔을때 검색해서 어렵게 구매하게 됐습니다.,지역마켓의 취지는 알겠는데 타지역의 채팅창이 활성화안돼서 아쉽습니다 정말 필요한 물건이 내지역외에 있는경우가 많은데 그럴경우 타지역으로 가서라도 구매해야 하는 경우가 있그덩요 개인적으로 이번 쇼파 구매의 경우도 제 지역에 없어서 부모님댁에 왔을때 검색해서 어렵게 구매하게 됐습니다,지역 마켓의 취지는 알겠는데 타 지역의 채팅창이 활성화 안돼서 아쉽습니다 정말 필요한 물건이 내 지역 외에 있는 경우가 많은데 그럴 경우 타 지역으로 가서라도 구매해야 하는 경우가 있그덩요 개인적으로 이번 소파 구매의 경우도 제 지역에 없어서 부모님댁에 왔을 때 검색해서 어렵게 구매하게 됐습니다
당근마켓,Dobby,2022년 3월 16일,1,1.0,아무 문제 없는 판매글을 누군가 신고 하면 미등록 처리 되고 문제가 많음,아무 문제 없는 판매글을 누군가 신고 하면 미등록 처리 되고 문제가 많음,아무 문제 없는 판매 굴을 누군가 신고하면 미등록 처리되고 문제가 많음
당근마켓,떠굼,2020년 5월 7일,4,5.0,계속 검색하기가 안 되네요 없는 물건이라고만 나오는데 있는 물건을 쳐도 아무것도 나오질 않아 많이 불편합니다 갑자기 오류가 뜬 건진 모르겠는데 어제부터 계속 이러네요 혹시 지웠다 깔면 괜찮을까 싶어서 몇 번을 지웠다가 다시 깔았는데도 계속 검색 자체가 되질 않습니다,계속 검색하기가 안 되네요 없는 물건이라고만 나오는데 있는 물건을 쳐도 아무것도 나오질 않아 많이 불편합니다 갑자기 오류가 뜬 건진 모르겠는데 어제부터 계속 이러네요 혹시 지웠다 깔면 괜찮을까 싶어서 몇 번을 지웠다가 다시 깔았는데도 계속 검색 자체가 되질 않습니다,계속 검색하기가 안 되네요 없는 물건이라고만 나오는 데 있는 물건을 쳐도 아무것도 나오질 않아 많이 불편합니다 갑자기 오류가 뜬 건진 모르겠는데 어제부터 계속 이러네요 혹시 지웠다 깔면 괜찮을까 싶어서 몇 번을 지웠다가 다시 깔았는데도 계속 검색 자체가 되질 않습니다
당근마켓,조수민,2020년 12월 19일,1,1.0,"자기가 잘못산 책을 패드립치면서 다시 환불해달라고 하더라고요. 그래서 안한다고했더니 그 분께서 신고를 하셨더라고요. 결국에 환불해드렸어요. 갑자기 그분이 저를 차단하면서 제 계정이 30일동안 정지를 당했어요. 그랴서 지금까지 당근을 못하고 있어요. 너무 어이없고 황당해서 저도 신고하려고 했는데 신고가 안되네요 몇번이나 장문으로 신고를 했는데 신고가 안되요. 당근마켓 앱 좋게 생각하고 있었는데 이런 일로 계기로 다시 봤네요 이 앱 좋은 점도 있지만 단점이 많다는걸. 이 앱 지우고 '번개장터'앱을 깔았어요. 휠신 백배 천배 낮더라고요....
전체 리뷰",자기가 잘못산 책을 패드립치면서 다시 환불해달라고 하더라고요 그래서 안한다고했더니 그 분께서 신고를 하셨더라고요 결국에 환불해드렸어요 갑자기 그분이 저를 차단하면서 제 계정이 일동안 정지를 당했어요 그랴서 지금까지 당근을 못하고 있어요 너무 어이없고 황당해서 저도 신고하려고 했는데 신고가 안되네요 몇번이나 장문으로 신고를 했는데 신고가 안되요 당근마켓 앱 좋게 생각하고 있었는데 이런 일로 계기로 다시 봤네요 이 앱 좋은 점도 있지만 단점이 많다는걸 이 앱 지우고 번개장터 앱을 깔았어요 휠신 백배 천배 낮더라고요 전체 리뷰,자기가 잘못 살 책을 패드립치면서 다시 환불해달라고 하더라고요 그래서 안 한다고 했더니 그분께서 신고를 하셨더라고요 결국에 환불해드렸어요 갑자기 그분이 저를 차단하면서 제 계정이 일 동안 정지를 당했어요 그래서 지금까지 당근을 못하고 있어요 너무 어이없고 황당해서 저도 신고하려고 했는데 신고가 안되네요 몇 번이나 장문으로 신고를 했는데 신고가 안돼요 당근 마켓 앱 좋게 생각하고 있었는데 이런 일로 계기로 다시 봤네요 이 앱 좋은 점도 있지만 단점이 많다는 걸 이 앱 지우고 번개장터 앱을 깔았어요 휠씬 백배 천배 낮더라고요 전체 리뷰
당근마켓,Micaheala준희,2020년 11월 23일,5,1.0,이틀 전부터 어플 튕김 강제 종료 스크롤 제한등 버그현상있습니다. 업뎃 된 후 부터 인것 같아요. 잘 사용하고 있고 좋습니다. 이런 현상 보안 업뎃이 빨리되었음 좋겠습니다.,이틀 전부터 어플 튕김 강제 종료 스크롤 제한등 버그현상있습니다 업뎃 된 후 부터 인것 같아요 잘 사용하고 있고 좋습니다 이런 현상 보안 업뎃이 빨리되었음 좋겠습니다,이틀 전부터 어플 튕김 강제 종료 스크롤 제한 등 버그 현상 있습니다 업데이트 된 후부터 인 것 같아요 잘 사용하고 있고 좋습니다 이런 현상 보안 업데이트가 빨리 되었으면 좋겠습니다
당근마켓,TONY,2022년 2월 17일,1,4.0,"폰과 번호가 동시에 바뀌어 새폰으로 인증받고 로그인하려는데 안되서, 새로 가입하려해도 인증 문자도 안오고, 고객센터에 2번이나 문의를 해도 답은 없고...지우고 다시 깔고...여러번하다가...우연히 이곳에서 리뷰를 봤는데 여기에 댓글은 잘 달고있네요...고객센터 문의에도 답 좀 주시지....",폰과 번호가 동시에 바뀌어 새폰으로 인증받고 로그인하려는데 안되서 새로 가입하려해도 인증 문자도 안오고 고객센터에 번이나 문의를 해도 답은 없고 지우고 다시 깔고 여러번하다가 우연히 이곳에서 리뷰를 봤는데 여기에 댓글은 잘 달고있네요 고객센터 문의에도 답 좀 주시지,폰과 번호가 동시에 바뀌어 새 폰으로 인증받고 로그인하려는데 안돼서 새로 가입하려 해도 인증 문자도 안 오고 고객센터에 번이나 문의를 해도 답은 없고 지우고 다시 깔고 여러 번 하다가 우연히 이곳에서 리뷰를 봤는데 여기에 댓글은 잘 달고 있네요 고객센터 문의에도 답 좀 주시지
당근마켓,눈사람,2020년 11월 11일,5,1.0,"당근마켓이 3년정도 사용중, 유명해지면서 중고나라 양아치들이 많이넘어온듯합니다, 같은지역안에서만 거래할수있는게 진짜 좋은듯해요, 찾는물건이 타도시에 진짜 저렴하게 나와도 구매할수 없는게 가장 큰 매력인듯합니다, 자기지역안에서만 거래를 하다보니 직거래를 하여 사기꾼도 거의없고요, 가끔 여기저기 같은제품을 가격만 다르게 올려놓고 저울질하는 쓰레기들이 보이기는합니다, 당근마켓은 타앱대비 저렴하게 판매되는 제품들이 많아 좋아요",당근마켓이 년정도 사용중 유명해지면서 중고나라 양아치들이 많이넘어온듯합니다 같은지역안에서만 거래할수있는게 진짜 좋은듯해요 찾는물건이 타도시에 진짜 저렴하게 나와도 구매할수 없는게 가장 큰 매력인듯합니다 자기지역안에서만 거래를 하다보니 직거래를 하여 사기꾼도 거의없고요 가끔 여기저기 같은제품을 가격만 다르게 올려놓고 저울질하는 쓰레기들이 보이기는합니다 당근마켓은 타앱대비 저렴하게 판매되는 제품들이 많아 좋아요,당근 마켓이 년 정도 사용 중 유명해지면서 중고나라 양아치들이 많이 넘어온 듯합니다 같은 지역 안에서만 거래할 수 있는 게 진짜 좋은듯해요 찾는 물건이 타 도시에 진짜 저렴하게 나와도 구매할 수 없는 게 가장 큰 매력인듯합니다 자기 지역 안에서만 거래를 하다 보니 직거래를 하여 사기꾼도 거의 없고요 가끔 여기저기 같은 제품을 가격만 다르게 올려놓고 저울질하는 쓰레기들이 보이기는 합니다 당근 마켓은 타앱대비 저렴하게 판매되는 제품들이 많아 좋아요
당근마켓,S.J P,2021년 2월 19일,4,28.0,정말 좋은 어플입니다만 몇 가지 아쉬움이 있습니다. 카테고리 설정시에도 최대가 입력란이 있으면 좋겠습니다. 최대가 입력란은 검색한 뒤 필터설정시에만 생기더군요. 그리고 무료나눔란이 따로 있었으면 좋겠습니다. 시간에 여유 있으실 때 재고 부탁드립니다. 그렇게 된다면 제게 정말 유용한 어플이 될 것 같습니다. 이런 앱을 만들어 주셔서 정말 감사합니다.,정말 좋은 어플입니다만 몇 가지 아쉬움이 있습니다 카테고리 설정시에도 최대가 입력란이 있으면 좋겠습니다 최대가 입력란은 검색한 뒤 필터설정시에만 생기더군요 그리고 무료나눔란이 따로 있었으면 좋겠습니다 시간에 여유 있으실 때 재고 부탁드립니다 그렇게 된다면 제게 정말 유용한 어플이 될 것 같습니다 이런 앱을 만들어 주셔서 정말 감사합니다,정말 좋은 어플입니다만 몇 가지 아쉬움이 있습니다 카테고리 설정 시에도 최대가 입력란이 있으면 좋겠습니다 최대가 입력란은 검색한 뒤 필터 설정 시에 만 생기더군요 그리고 무료 나눔 한 이 따로 있었으면 좋겠습니다 시간에 여유 있으실 때 재고 부탁드립니다 그렇게 된다면 제게 정말 유용한 어플이 될 것 같습니다 이런 앱을 만들어 주셔서 정말 감사합니다
당근마켓,오유아,2020년 6월 27일,1,,동네설정에 지역을 2개까지 설정할수있는데 내동네가 아니면 실질적으로 다른 지역에 채팅걸기로 거래를 못합니다. 즉 내동네에 원하는 상품이 없어서 1시간거리인 가까운 지역에 매물발견해도 채팅이 안되니 직거래 시도가 불가능. 이럴거면 동네설정 왜 2개인지 이유를 묻고싶고 가까운 지역에 거래가 가능해지면 판매자나 구매자 모두에게 좋은거 아닌가 왜 막는건지 이해불가,동네설정에 지역을 개까지 설정할수있는데 내동네가 아니면 실질적으로 다른 지역에 채팅걸기로 거래를 못합니다 즉 내동네에 원하는 상품이 없어서 시간거리인 가까운 지역에 매물발견해도 채팅이 안되니 직거래 시도가 불가능 이럴거면 동네설정 왜 개인지 이유를 묻고싶고 가까운 지역에 거래가 가능해지면 판매자나 구매자 모두에게 좋은거 아닌가 왜 막는건지 이해불가,동네 설정에 지역을 개까지 설정할 수 있는데 내동네가 아니면 실질적으로 다른 지역에 채팅 걸기로 거래를 못합니다 즉 내동네에 원하는 상품이 없어서 시간거리인 가까운 지역에 매물 발견해도 채팅이 안되니 직거래 시도가 불가능 이럴 거면 동네 설정 왜 개인지 이유를 묻고 싶고 가까운 지역에 거래가 가능해지면 판매자나 구매자 모두에게 좋은 거 아닌가 왜 막는 건지 이해불가
당근마켓,루아,2022년 2월 18일,4,5.0,"제가 쓴 리뷰에 답글을 달아주셨는데 제 리뷰가 보이지 않네요.. 원래 리뷰란에 제 리뷰가 떠야하는데 뜨지 않고, 새로 작성할 수 있게만 떠있네요ㅠ 당근채팅 알림이 자꾸 오지 않는데 삭제 후 재설치, 알림 설정, 절약모드 해제 설정했는데도 안옵니다ㅠㅠ 키워드알림은 잘 오는데 다른 해결방법 있을까요?",제가 쓴 리뷰에 답글을 달아주셨는데 제 리뷰가 보이지 않네요 원래 리뷰란에 제 리뷰가 떠야하는데 뜨지 않고 새로 작성할 수 있게만 떠있네요 당근채팅 알림이 자꾸 오지 않는데 삭제 후 재설치 알림 설정 절약모드 해제 설정했는데도 안옵니다 키워드알림은 잘 오는데 다른 해결방법 있을까요 ,제가 쓴 리뷰에 답글을 달아주셨는데 제 리뷰가 보이지 않네요 원래 리뷰난에 제 리뷰가 떠야 하는데 뜨지 않고 새로 작성할 수 있게만 떠있네요 당근 채팅 알림이 자꾸 오지 않는데 삭제 후 재설치 알림 설정 절약 모드 해제 설정했는데도 안 옵니다 키워드 알림은 잘 오는데 다른 해결 방법 있을까요 
당근마켓,휘뚜루마뚜루,2022년 5월 2일,1,,"답변없으셔서 수정합니다 안녕하세요 당근을 이용중인 유저입니다 좋은 물품을 좋은 가격에 구한 적 많은 사람인데 최근 거래하기로 약속해놓고 약속장소에 시간맞춰 다왔는데 다른사람이랑 거래했다면서 아예 차단한 판매자가 있습니다. 거래를 하지 않으면 판매자를 신고도, 비매너평가도 할 수 없어서 매우 기분 나쁘고 속상하네요 마음 같아서는 개발자님께 그분 계정 온도라도 조정해달라고 요청드리고 싶은데 할 수 있는 방법이 없어서 평가로 남깁니다 다음 업데이트 때는 이런 비매너적인 상황이 있을 때도 평가할 수 있도록 하는 조취가 이루어질 수 있었으면...
전체 리뷰",답변없으셔서 수정합니다 안녕하세요 당근을 이용중인 유저입니다 좋은 물품을 좋은 가격에 구한 적 많은 사람인데 최근 거래하기로 약속해놓고 약속장소에 시간맞춰 다왔는데 다른사람이랑 거래했다면서 아예 차단한 판매자가 있습니다 거래를 하지 않으면 판매자를 신고도 비매너평가도 할 수 없어서 매우 기분 나쁘고 속상하네요 마음 같아서는 개발자님께 그분 계정 온도라도 조정해달라고 요청드리고 싶은데 할 수 있는 방법이 없어서 평가로 남깁니다 다음 업데이트 때는 이런 비매너적인 상황이 있을 때도 평가할 수 있도록 하는 조취가 이루어질 수 있었으면 전체 리뷰,답변 없으셔서 수정합니다 안녕하세요 당근을 이용 중인 유저입니다 좋은 물품을 좋은 가격에 구한 적 많은 사람인데 최근 거래하기로 약속해놓고 약속 장소에 시간 맞춰 다 왔는데 다른 사람이랑 거래했다면서 아예 차단한 판매자가 있습니다 거래를 하지 않으면 판매자를 신고도 비매너 평가도 할 수 없어서 매우 기분 나쁘고 속상하네요 마음 같아서는 개발자님께 그분 계정 온도라도 조정해달라고 요청드리고 싶은데 할 수 있는 방법이 없어서 평가로 남깁니다 다음 업데이트 때는 이런 비매너적인 상황이 있을 때도 평가할 수 있도록 하는 조치가 이루어질 수 있었으면 전체 리뷰
당근마켓,Jason Seo,2021년 12월 5일,5,,왜 당근당근 🥕 하는지 알겠네요 ㅎㅎ 너무 편한 인터페이스에 동네 주변 거래까지 컨셉도 좋고 너무 좋네요 ㅎㅎ 당근 빠지겠어요 이러다 ㅎㅎ 잘쓰겠습니다 ㅎㅎ,왜 당근당근 하는지 알겠네요 너무 편한 인터페이스에 동네 주변 거래까지 컨셉도 좋고 너무 좋네요 당근 빠지겠어요 이러다 잘쓰겠습니다 ,왜 당근 당근 하는지 알겠네요 너무 편한 인터페이스에 동네 주변 거래까지 콘셉트도 좋고 너무 좋네요 당근 빠지겠어요 이러다 잘 쓰겠습니다
당근마켓,JS KIM,2021년 7월 18일,5,,"당근마켓을 테스크탑이나 노트북에서는 사용하지 못하나요? 카카오톡처럼 일반 컴퓨터에서도 사용가능하도록 해주시면 안되나요? 휴대폰으로만 사용하는 것은 너무 불편하더군요. 이미 사용가능한데, 제가 잘 모르고 있는 것인지도 모르겠네요. 답변 부탁 드립니다. 감사합니다. ^^",당근마켓을 테스크탑이나 노트북에서는 사용하지 못하나요 카카오톡처럼 일반 컴퓨터에서도 사용가능하도록 해주시면 안되나요 휴대폰으로만 사용하는 것은 너무 불편하더군요 이미 사용가능한데 제가 잘 모르고 있는 것인지도 모르겠네요 답변 부탁 드립니다 감사합니다 ,당근 마켓을 테스크탑이나 노트북에서는 사용하지 못하나요 카카오톡처럼 일반 컴퓨터에서도 사용 가능하도록 해주시면 안 되나요 휴대폰으로만 사용하는 것은 너무 불편하더군요 이미 사용 가능한데 제가 잘 모르고 있는 것인지도 모르겠네요 답변 부탁드립니다 감사합니다 
당근마켓,푸아송,2021년 3월 10일,3,1.0,활동알림하고 키워드알림 보는 곳 코드 수정해야할것같아요. 위아래 스크롤 하는데 쑥잘될때도있지만 뚝뚝끊기는경우가 더 많습니다. 활동알림에서 위아래스크롤하는데 키워드알림쪽으로 옆으로 넘어가는경우도있고요,활동알림하고 키워드알림 보는 곳 코드 수정해야할것같아요 위아래 스크롤 하는데 쑥잘될때도있지만 뚝뚝끊기는경우가 더 많습니다 활동알림에서 위아래스크롤하는데 키워드알림쪽으로 옆으로 넘어가는경우도있고요,활동 알림하고 키워드 알림 보는 곳 코드 수정해야 할 것 같아요 위아래 스크롤 하는데 쑥 잘 될 때도 있지만 뚝뚝 끊기는 경우가 더 많습니다 활동 알림에서 위아래 스크롤 하는데 키워드 알린 쪽으로 옆으로 넘어가는 경우도 있고요
당근마켓,비유,2022년 4월 10일,4,1.0,다 좋은데 왜 괜히 끌올을 15회로 제한을 두었는지 모르겠습니다.. 끌올 제한 자체를 없애주시면 좋겠어요...,다 좋은데 왜 괜히 끌올을 회로 제한을 두었는지 모르겠습니다 끌올 제한 자체를 없애주시면 좋겠어요,다 좋은데 왜 괜히 끌질을 회로 제한을 두었는지 모르겠습니다 들올 제한 자체를 없애주시면 좋겠어요
당근마켓,granatum punica,2022년 1월 19일,4,3.0,무료나눔을 한달에 스무번씩 받고 다니는 사람은 온도가 80도 90도 이런데 정작 정상적으로 판매하는 사람은 40도 올리기도 힘들어요. 공짜만 노리고 다니는 사람들을 경험해보면 예의도 국밥처럼 말아드신분이 많은데 (무료나눔인데 낡았다고 난리) 온도는 높다보니 신뢰성에 문제가 많이 생깁니다. 무료나눔을 한 사람은 온도가 올라가고 받은 사람은 약간 내려가는 식이 맞지 않나 싶습니다. 포인트 사용처럼 말입니다.,무료나눔을 한달에 스무번씩 받고 다니는 사람은 온도가 도 도 이런데 정작 정상적으로 판매하는 사람은 도 올리기도 힘들어요 공짜만 노리고 다니는 사람들을 경험해보면 예의도 국밥처럼 말아드신분이 많은데 무료나눔인데 낡았다고 난리 온도는 높다보니 신뢰성에 문제가 많이 생깁니다 무료나눔을 한 사람은 온도가 올라가고 받은 사람은 약간 내려가는 식이 맞지 않나 싶습니다 포인트 사용처럼 말입니다,무료 나눔을 한 달에 스무 번씩 받고 다니는 사람은 온도가 도 도 이런데 정작 정상적으로 판매하는 사람은 도 올리기도 힘들어요 공짜만 노리고 다니는 사람들을 경험해보면 예의도 국밥처럼 말아 드신 분이 많은데 무료 나눔인데 낡았다고 난리 온도는 높다 보니 신뢰성에 문제가 많이 생깁니다 무료 나눔을 한 사람은 온도가 올라가고 받은 사람은 약간 내려가는 식이 맞지 않나 싶습니다 포인트 사용처럼 말입니다
당근마켓,심기현,2022년 4월 6일,1,,닉네임 쏘낙비 휴대폰 인증 시 정상적이지 않은 사용 패턴 감지고 인해 로그인이 제한됩니다 팝업이 내오는데 확인 바랍니다,닉네임 쏘낙비 휴대폰 인증 시 정상적이지 않은 사용 패턴 감지고 인해 로그인이 제한됩니다 팝업이 내오는데 확인 바랍니다,닉네임 소낙비 휴대폰 인증 시 정상적이지 않은 사용 패턴 감지고 인해 로그인이 제한됩니다 팝업이 내오는데 확인 바랍니다
