앱이름,유저이름,리뷰날짜,평점,리뷰의 좋아요 개수,리뷰 내용,전처리1,spell_check
당근마켓,장현주,2019년 10월 2일,5,2.0,가지고 잇는 개인들의 물건을 손쉽게 동네분들과 직거래 할 수 잇는 좋은 장터입니다. 그냥 버리기에는 죄스럽고 아까운 물건들이 제 값을 하게 해주는 좋은 앱입니다. 또 얼굴 아는 누군가에게 그냥 주기에는 잘 적합한 취향인지 고려하기 귀찮고 번거로워 결국 쓰레기장으로 직행하기 쉬웟던 물건들이 필요한 분들에게 전달되어 재화로 개인에게 돌아오니 참 좋은 앱이 아닐 수 없습니다.,가지고 잇는 개인들의 물건을 손쉽게 동네분들과 직거래 할 수 잇는 좋은 장터입니다 그냥 버리기에는 죄스럽고 아까운 물건들이 제 값을 하게 해주는 좋은 앱입니다 또 얼굴 아는 누군가에게 그냥 주기에는 잘 적합한 취향인지 고려하기 귀찮고 번거로워 결국 쓰레기장으로 직행하기 쉬웟던 물건들이 필요한 분들에게 전달되어 재화로 개인에게 돌아오니 참 좋은 앱이 아닐 수 없습니다,가지고 있는 개인들의 물건을 손쉽게 동네분들과 직거래 할 수 있는 좋은 장터입니다 그냥 버리기에는 죄스럽고 아까운 물건들이 제값을 하게 해주는 좋은 앱입니다 또 얼굴 아는 누군가에게 그냥 주기에는 잘 적합한 취향인지 고려하기 귀찮고 번거로워 결국 쓰레기장으로 직행하기 쉬웠던 물건들이 필요한 분들에게 전달되어 재화로 개인에게 돌아오니 참 좋은 앱이 아닐 수 없습니다
당근마켓,웅.,2021년 6월 29일,3,,"당근마켓이라고 하지만 '전국에서 물건 찾기' 이런 식으로 전국에서 물건을 찾는 기능을 추가 해주시면 안될까요? 예를들면 서울에는 있는 제품인데 부산에는 없는 중고 제품이 있다고 친다면, 부산에 사는 사람은 그 물건을 찾고 싶어도 검색조차 안 나옵니다. ''충분히 타지에서 구할 수 있는데도'' 말입니다. 그럴거면 다른 어플을 써라할 수 있지만 당근마켓이 정말 다양하고 다른어플에서는 못 구하는 제품들이 많기 때문에 '전국검색' 기능을 좀 추가 해주셨으면 합니다.",당근마켓이라고 하지만 전국에서 물건 찾기 이런 식으로 전국에서 물건을 찾는 기능을 추가 해주시면 안될까요 예를들면 서울에는 있는 제품인데 부산에는 없는 중고 제품이 있다고 친다면 부산에 사는 사람은 그 물건을 찾고 싶어도 검색조차 안 나옵니다 충분히 타지에서 구할 수 있는데도 말입니다 그럴거면 다른 어플을 써라할 수 있지만 당근마켓이 정말 다양하고 다른어플에서는 못 구하는 제품들이 많기 때문에 전국검색 기능을 좀 추가 해주셨으면 합니다,당근 마켓이라고 하지만 전국에서 물건 찾기 이런 식으로 전국에서 물건을 찾는 기능을 추가해주시면 안 될까요 예를 들면 서울에는 있는 제품인데 부산에는 없는 중고 제품이 있다고 친다면 부산에 사는 사람은 그 물건을 찾고 싶어도 검색조차 안 나옵니다 충분히 타지에서 구할 수 있는데도 말입니다 그럴 거면 다른 어플을 써라 할 수 있지만 당근 마켓이 정말 다양하고 다른 어플에서는 못 구하는 제품들이 많기 때문에 전국 검색 기능을 좀 추가해주셨으면 합니다
당근마켓,김민옥뉴스킨,2019년 2월 1일,5,16.0,"당근! 최고입니다. 사치스러워진 요즘 나눠쓰는 멋진 이런앱을 만드신 분께 박수를드립니다. 쓰레기 대란인 요즘 환경도 생각하고 재활용하면서 정도 나누고 두달째 당근의 늪 에서 헤어나오지 못하고있습니다. 애 키우면서 필요한것들 필요 없어도 사주고 싶었던것들을 당근에서 충족 하고 있습니다. 새것 샀을때와 비교 해보았을때 실가격에 10%밖에 안되는 금액에 구매해서 쓰고있더라구요^^ 물론 중고라는점이 있지만....그래도 물건 내놓으실때 상세한 설명과 사진을 올려주셔서 어떤상태인지 알고사니 괜찮습니다. 가끔 매너 안좋은분들도 있다는 말이 있는...
전체 리뷰",당근 최고입니다 사치스러워진 요즘 나눠쓰는 멋진 이런앱을 만드신 분께 박수를드립니다 쓰레기 대란인 요즘 환경도 생각하고 재활용하면서 정도 나누고 두달째 당근의 늪 에서 헤어나오지 못하고있습니다 애 키우면서 필요한것들 필요 없어도 사주고 싶었던것들을 당근에서 충족 하고 있습니다 새것 샀을때와 비교 해보았을때 실가격에 밖에 안되는 금액에 구매해서 쓰고있더라구요 물론 중고라는점이 있지만 그래도 물건 내놓으실때 상세한 설명과 사진을 올려주셔서 어떤상태인지 알고사니 괜찮습니다 가끔 매너 안좋은분들도 있다는 말이 있는 전체 리뷰,당근 최고입니다 사치스러워진 요즘 나눠쓰는 멋진 이런 앱을 만드신 분께 박수를 드립니다 쓰레기 대란인 요즘 환경도 생각하고 재활용하면서 정도 나누고 두 달째 당근의 늪에서 헤어 나오지 못하고 있습니다 애 키우면서 필요한 것들 필요 없어도 사주고 싶었던 것들을 당근에서 충족하고 있습니다 새것 샀을 때와 비교해보았을 때 실사격에 밖에 안되는 금액에 구매해서 쓰고 있더라고요 물론 중고라는 점이 있지만 그래도 물건 내놓으실 때 상세한 설명과 사진을 올려주셔서 어떤 상태인지 알고 사니 괜찮습니다 가끔 매너 안 좋은 분들도 있다는 말이 있는 전체 리뷰
당근마켓,맷돌,2020년 11월 23일,4,3.0,앱이 자꾸 종료되어 사용이 불가하네요. 업데이트 이후인지 관심 및 키워드 데이터가 롤백되어 보이기도 하고 시도때도 없이 앱이 종료됩니다. 여러번 깔고 지웠다 해도 동일합니다 ㅠ,앱이 자꾸 종료되어 사용이 불가하네요 업데이트 이후인지 관심 및 키워드 데이터가 롤백되어 보이기도 하고 시도때도 없이 앱이 종료됩니다 여러번 깔고 지웠다 해도 동일합니다 ,앱이 자꾸 종료되어 사용이 불가하네요 업데이트 이후인지 관심 및 키워드 데이터가 롤백 되어 보이기도 하고 시도 때도 없이 앱이 종료됩니다 여러 번 깔고 지웠다 해도 동일합니다 
당근마켓,짭랭이,2021년 1월 30일,1,,업뎃되면서 점점 더 불편해짐. 처음에는 비로그인으로도 쓸 수 있었는데 이제는 안 되고 예약 중일 때는 연락을 아예 못 하게 만듦!! 가끔 예약 중일 때도 연락해야 하는 경우가 있는데 그걸 없애니 불편해 뒤지겠음. 그리고 당근에 거지가 아주 그냥 널려서 못 쓰겠음. 어휴.......,업뎃되면서 점점 더 불편해짐 처음에는 비로그인으로도 쓸 수 있었는데 이제는 안 되고 예약 중일 때는 연락을 아예 못 하게 만듦 가끔 예약 중일 때도 연락해야 하는 경우가 있는데 그걸 없애니 불편해 뒤지겠음 그리고 당근에 거지가 아주 그냥 널려서 못 쓰겠음 어휴,업데이트되면서 점점 더 불편해짐 처음에는 비로그인으로도 쓸 수 있었는데 이제는 안 되고 예약 중일 때는 연락을 아예 못 하게 만듦 가끔 예약 중일 때도 연락해야 하는 경우가 있는데 그걸 없애니 불편해 뒤지겠음 그리고 당근에 거지가 아주 그냥 널려서 못 쓰겠음 어휴
당근마켓,이성수,2021년 3월 21일,1,,동네인증이 된 두개의 동네만 이용할수 있다는 단점 다른 지역으로 가서 택배가 아닌 직거래로 구매할 의사가 있음에도 무조건 적인 제한으로 인하여 내가 원하는 물건이 동네에 없으면 사지 못하는 것. 자신이 대도시에 살고 있지 않다면 제약은 많은 어플이에요. 문의 드렸음에도 앵무새같은 대답으로 인해 어플 사용안합니다.,동네인증이 된 두개의 동네만 이용할수 있다는 단점 다른 지역으로 가서 택배가 아닌 직거래로 구매할 의사가 있음에도 무조건 적인 제한으로 인하여 내가 원하는 물건이 동네에 없으면 사지 못하는 것 자신이 대도시에 살고 있지 않다면 제약은 많은 어플이에요 문의 드렸음에도 앵무새같은 대답으로 인해 어플 사용안합니다,동네 인증이 된 두 개의 동네만 이용할 수 있다는 단점 다른 지역으로 가서 택배가 아닌 직거래로 구매할 의사가 있음에도 무조건 적인 제한으로 인하여 내가 원하는 물건이 동네에 없으면 사지 못하는 것 자신이 대도시에 살고 있지 않다면 제약은 많은 어플이에요 문의드렸음에도 앵무새 같은 대답으로 인해 어플 사용 안 합니다
당근마켓,Kyung A Cho,2021년 2월 13일,5,,이사하면서 쓰지않던 물건.좋은 물건들을 내놓았네요.가져가시는분들도 좋아하시고.저도 좋고.단!!가져가시겠다고 했다가 연락두절되시는 분들이 있는데.간단하게 구매의사포기~를 할수있는 시스템이 있어도 좋을듯요.몇번 시간약속했다가~포기하시려면 맘이 편치 않으셨나보네요.저는 괜찮은데~~~,이사하면서 쓰지않던 물건 좋은 물건들을 내놓았네요 가져가시는분들도 좋아하시고 저도 좋고 단 가져가시겠다고 했다가 연락두절되시는 분들이 있는데 간단하게 구매의사포기 를 할수있는 시스템이 있어도 좋을듯요 몇번 시간약속했다가 포기하시려면 맘이 편치 않으셨나보네요 저는 괜찮은데 ,이사하면서 쓰지 않던 물건 좋은 물건들을 내놓았네요 가져가시는 분들도 좋아하시고 저도 좋고 단 가져가시겠다고 했다가 연락 두절되시는 분들이 있는데 간단하게 구매의사 포기를 할 수 있는 시스템이 있어도 좋을 듯요 몇 번 시간 약속했다가 포기하시려면 맘이 편치 않으셨나 보네요 저는 괜찮은데 
당근마켓,이지용,2020년 1월 26일,4,12.0,전반적으로 잘 이용하고 있습니다! 다만 키워드알림을 몇개 해놨는데 어느순간부터 그때그때 알림이 오지 않고 갑자기 한번에 몰아서 3~4개씩 알림이 오네요... 그래서 알림소리가 계속 겹쳐서 나오고 정신없네요ㅠ,전반적으로 잘 이용하고 있습니다 다만 키워드알림을 몇개 해놨는데 어느순간부터 그때그때 알림이 오지 않고 갑자기 한번에 몰아서 개씩 알림이 오네요 그래서 알림소리가 계속 겹쳐서 나오고 정신없네요 ,전반적으로 잘 이용하고 있습니다 다만 키워드 알림을 몇 개 해놨는데 어느 순간부터 그때그때 알림이 오지 않고 갑자기 한 번에 몰아서 개씩 알림이 오네요 그래서 알림 소리가 계속 겹쳐서 나오고 정신없네요 
당근마켓,치즈초,2020년 7월 6일,2,2.0,"다 좋은 나머지 자신의 동네인증을한 뒤 사고싶은 물건을 고르는 과정에서 예를들어 제가 서울에 사는데 원하는 물건판매자 지역이 부산인 경우 문자가 되지않아 위치를 바꾸니 동네인증때문에 되지가 않습니다. 택배로도 가능한데 구지 자신의 동네에서만 구매할수있는 이유가 뭐죠? 그리고 자신의 동네에서는 원하는 물건을 찾지못하고,다른 지역에 물건들이 더 마음에든 경우, 원하는걸 검색한 뒤 찾아보니 자신의 동네에는 없는것. 이점이 가장 화가납니다..이건 중고거레마켓인데 서로 다른지역이라고 거래불가능이 가장 불편합니다. 충분히 교통시설 이용하면 2...
전체 리뷰",다 좋은 나머지 자신의 동네인증을한 뒤 사고싶은 물건을 고르는 과정에서 예를들어 제가 서울에 사는데 원하는 물건판매자 지역이 부산인 경우 문자가 되지않아 위치를 바꾸니 동네인증때문에 되지가 않습니다 택배로도 가능한데 구지 자신의 동네에서만 구매할수있는 이유가 뭐죠 그리고 자신의 동네에서는 원하는 물건을 찾지못하고 다른 지역에 물건들이 더 마음에든 경우 원하는걸 검색한 뒤 찾아보니 자신의 동네에는 없는것 이점이 가장 화가납니다 이건 중고거레마켓인데 서로 다른지역이라고 거래불가능이 가장 불편합니다 충분히 교통시설 이용하면 전체 리뷰,다 좋은 나머지 자신의 동네 인증을 한 뒤 사고 싶은 물건을 고르는 과정에서 예를 들어 제가 서울에 사는데 원하는 물건 판매자 지역이 부산인 경우 문자가 되지 않아 위치를 바꾸니 동네 인증 때문에 되지가 않습니다 택배로도 가능한데 굳이 자신의 동네에서만 구매할 수 있는 이유가 뭐죠 그리고 자신의 동네에서는 원하는 물건을 찾지 못하고 다른 지역에 물건들이 더 마음에 든 경우 원하는 걸 검색한 뒤 찾아보니 자신의 동네에는 없는 것 이점이 가장 화가 납니다 이건 중고 거래 마켓인데 서로 다른 지역이라고 거래 불가능이 가장 불편합니다 충분히 교통시설 이용하면 전체 리뷰
당근마켓,Kwon Sanghun,2020년 8월 20일,5,158.0,가까운 곳에서 중고로 사고 팔 수 있어서 좋아요 한가지 건의 드리자면 중고거래 물품 사진올릴때 워터마크 설정하는 기능 만들어 주시면 좋겠어요. 다른사람이 타인이 찍은 사진을 도용해서 다른 사이트에서 사용하는 걸 봤어요... 워터마크 기능이 있으면 좋을 것 같아요,가까운 곳에서 중고로 사고 팔 수 있어서 좋아요 한가지 건의 드리자면 중고거래 물품 사진올릴때 워터마크 설정하는 기능 만들어 주시면 좋겠어요 다른사람이 타인이 찍은 사진을 도용해서 다른 사이트에서 사용하는 걸 봤어요 워터마크 기능이 있으면 좋을 것 같아요,가까운 곳에서 중고로 사고팔 수 있어서 좋아요 한가지 건의드리자면 중고거래 물품 사진 올릴 때 워터마크 설정하는 기능 만들어 주시면 좋겠어요 다른 사람이 타인이 찍은 사진을 도용해서 다른 사이트에서 사용하는 걸 봤어요 워터마크 기능이 있으면 좋을 것 같아요
당근마켓,김서화,2021년 9월 15일,4,30.0,평소 당근마켓을 애용하고있는 애용자 입니다. 얼마전에는 채팅과 키워드 알림음 설정을 다르게 할수있게 해 주어서 더 편리하게 사용하고 있어요. 그런데 가끔씩 알림음이 먹통일 때가 있어요 알림설정이 다 정상적으로 되어 있는데도 말이죠 로그아웃을 하고 다시 로그인을 하라고해서 로그아웃을 했는데 이번엔 로그인이 안되네요. 로그인 인증번호를 확인해서 입력하려고 당근을 열면 인증창이 나타나질 않고 로그인상태로 열리고 알림음은 여전히 먹통 입니다. 알림이 먹통이니 너무 답답합니다. 해결책좀 주세요.,평소 당근마켓을 애용하고있는 애용자 입니다 얼마전에는 채팅과 키워드 알림음 설정을 다르게 할수있게 해 주어서 더 편리하게 사용하고 있어요 그런데 가끔씩 알림음이 먹통일 때가 있어요 알림설정이 다 정상적으로 되어 있는데도 말이죠 로그아웃을 하고 다시 로그인을 하라고해서 로그아웃을 했는데 이번엔 로그인이 안되네요 로그인 인증번호를 확인해서 입력하려고 당근을 열면 인증창이 나타나질 않고 로그인상태로 열리고 알림음은 여전히 먹통 입니다 알림이 먹통이니 너무 답답합니다 해결책좀 주세요,평소 당근 마켓을 애용하고 있는 애용자입니다 얼마 전에는 채팅과 키워드 알림음 설정을 다르게 할 수 있게 해 주어서 더 편리하게 사용하고 있어요 그런데 가끔씩 알림음이 먹통일 때가 있어요 알림 설정이 다 정상적으로 되어 있는데도 말이죠 로그아웃을 하고 다시 로그인을 하라고 해서 로그아웃을 했는데 이번엔 로그인이 안 되네요 로그인 인증번호를 확인해서 입력하려고 당근을 열면 인증 창의 나타나질 않고 로그인 상태로 열리고 알림음은 여전히 먹통입니다 알림이 먹통이니 너무 답답합니다 해결책 좀 주세요
당근마켓,띵띵효이,2019년 9월 1일,5,10.0,"가까운 곳에서 직접거래하기 때문에 식수가 적어요. 단, 근처에 좀더 확장해서 반경 50km정도는 검색해서 거래할수 있으면 좋을 듯해요. 다른 중고거래도 판매처가 없으면 멀리도가서 거래할수 있는데 이건 검색도 안되서요.",가까운 곳에서 직접거래하기 때문에 식수가 적어요 단 근처에 좀더 확장해서 반경 km정도는 검색해서 거래할수 있으면 좋을 듯해요 다른 중고거래도 판매처가 없으면 멀리도가서 거래할수 있는데 이건 검색도 안되서요,가까운 곳에서 직접거래하기 때문에 식수가 적어요 단 근처에 좀 더 확장해서 반경 km 정도는 검색해서 거래할 수 있으면 좋을 듯해요 다른 중고거래도 판매처가 없으면 멀리도 가서 거래할 수 있는데 이건 검색도 안돼서요
당근마켓,최현웅,2019년 1월 1일,4,,중고앱은 자고로 이용자가 많아야 되는데 그런점에서는 대만족입니다 이용도 편리하구요 다만 아쉬운점은 자기 지역물건만 살 수 있다는점 입니다 심지어 찜하기(?)도 안됨 앱의 원래 목적이 직거래중개니까 그럴 수 있다고 생각은 하는데 적어도 기프티콘이나 티켓같이 실물이 없는 대상의 거래는 지역 상관없이 할 수 있으면 좋겠네요,중고앱은 자고로 이용자가 많아야 되는데 그런점에서는 대만족입니다 이용도 편리하구요 다만 아쉬운점은 자기 지역물건만 살 수 있다는점 입니다 심지어 찜하기 도 안됨 앱의 원래 목적이 직거래중개니까 그럴 수 있다고 생각은 하는데 적어도 기프티콘이나 티켓같이 실물이 없는 대상의 거래는 지역 상관없이 할 수 있으면 좋겠네요,중고 앱은 자고로 이용자가 많아야 되는데 그런 점에서는 대만족입니다 이용도 편리하고요 다만 아쉬운 점은 자기 지역 물건만 살 수 있다는 점입니다 심지어 찜하기 도 안됨 앱의 원래 목적이 직거래 중개니까 그럴 수 있다고 생각은 하는데 적어도 기프티콘이나 티켓같이 실물이 없는 대상의 거래는 지역 상관없이 할 수 있으면 좋겠네요
당근마켓,김효정,2021년 1월 19일,3,69.0,"당근마켓으로 평생 안할것같던 직거래 시작했습니다 몇가지는 개선되면 좋겠어요 1. 사진첨부하면 워터마크가 박히면 좋겠음(도용방지) 2.내가 올린 상품및 다른사람의 판매글을 볼때 인기순,가격순,날짜 순서대로 볼수 있으면 좋겠음 4. 사진썸네일과 가격표시만 뜨게 설정하여 한번에 더많은 물건을 볼수있으면 좋겠음 3. 판매글을 올릴때 해시태그를 넣어서 검색시 게시글 노출이 더 잘되면 좋겠음 4. 직거래만 가능,택배만 가능,둘다가능 선택지를 넣어서 택배거래가 가능한경우 모든 지역 상품을 볼수 있으면 좋겠음 5. 끌올을 더 자주 할수있으면 좋겠...
전체 리뷰",당근마켓으로 평생 안할것같던 직거래 시작했습니다 몇가지는 개선되면 좋겠어요 사진첨부하면 워터마크가 박히면 좋겠음 도용방지 내가 올린 상품및 다른사람의 판매글을 볼때 인기순 가격순 날짜 순서대로 볼수 있으면 좋겠음 사진썸네일과 가격표시만 뜨게 설정하여 한번에 더많은 물건을 볼수있으면 좋겠음 판매글을 올릴때 해시태그를 넣어서 검색시 게시글 노출이 더 잘되면 좋겠음 직거래만 가능 택배만 가능 둘다가능 선택지를 넣어서 택배거래가 가능한경우 모든 지역 상품을 볼수 있으면 좋겠음 끌올을 더 자주 할수있으면 좋겠 전체 리뷰,당근 마켓으로 평생 안 할 것 같던 직거래 시작했습니다 몇 가지는 개선되면 좋겠어요 사진 첨부하면 워터마크가 박히면 좋겠음 도용방지 내가 올린 상품 및 다른 사람의 판매 굴을 볼 때 인기순 가격순 날짜 순서대로 볼 수 있으면 좋겠음 사진 섬네일과 가격 표시만 뜨게 설정하여 한 번에 더 많은 물건을 볼 수 있으면 좋겠음 판매 굴을 올릴 때 해시태그를 넣어서 검색 시 게시글 노출이 더 잘 되면 좋겠음 직거래만 가능 택배만 가능 둘 다 가능 선택지를 넣어서 택배 거래가 가능한 경우 모든 지역 상품을 볼 수 있으면 좋겠음 끌질을 더 자주 할 수 있으면 좋겠 전체 리뷰
당근마켓,곽상일,2021년 5월 23일,5,1.0,첫거래여서설래고 과연 물건이 좋을까? 하고 조금은... 그건 기우였네요^^ 나에겐 불용품이지만 어는누구에겐 필요한물건... 물건이 좋은주인을 다시만나 용도에 맞게 잘 쓰여진다면 주는사람은 또 다른 작은기쁨이요 사는분은 저렴하게 구입한다면 이또한 기쁨~^^ 첫거래 생각보다 더 좋은당근이라 생각합니다~ 감사합니다^^,첫거래여서설래고 과연 물건이 좋을까 하고 조금은 그건 기우였네요 나에겐 불용품이지만 어는누구에겐 필요한물건 물건이 좋은주인을 다시만나 용도에 맞게 잘 쓰여진다면 주는사람은 또 다른 작은기쁨이요 사는분은 저렴하게 구입한다면 이또한 기쁨 첫거래 생각보다 더 좋은당근이라 생각합니다 감사합니다 ,첫 거래여서 설레고 과연 물건이 좋을까 하고 조금은 그건 기우였네요 나에겐 불용품이지만 어는 누구에겐 필요한 물건 물건이 좋은 주인을 다시 만나 용도에 맞게 잘 쓰인다면 주는 사람은 또 다른 작은 기쁨이요 사는 분은 저렴하게 구입한다면 이 또한 기쁨 첫 거래 생각보다 더 좋은 당근이라 생각합니다 감사합니다 
당근마켓,행복주유소,2019년 9월 12일,5,8.0,♥매우 편리하고 쉬워요 ♥ 매우 매우 만족합니다. ★★★★★★★★ 전 매우 정겹고 편하게 소비자와 직접 이렇게 연결 될 수 있다는게 신기할 뿐입니다. ♥ 이번 가게 접으면서 중고물품 (새것도) 있는데 싸게 내 놨더니 요것저것 빠르게 나가네요.. 집에서 잠자는 물건들 빨리 빨리 필요한 분들께 가게 되시길... 정말 전 신이났네요... 전 팔아서 좋고 다른분들 가까운 곳에서 사서 좋고. 모두 모두 축복의 통로들 되시길.. (*^----------^*)/, 매우 편리하고 쉬워요 매우 매우 만족합니다 전 매우 정겹고 편하게 소비자와 직접 이렇게 연결 될 수 있다는게 신기할 뿐입니다 이번 가게 접으면서 중고물품 새것도 있는데 싸게 내 놨더니 요것저것 빠르게 나가네요 집에서 잠자는 물건들 빨리 빨리 필요한 분들께 가게 되시길 정말 전 신이났네요 전 팔아서 좋고 다른분들 가까운 곳에서 사서 좋고 모두 모두 축복의 통로들 되시길 , 매우 편리하고 쉬워요 매우 매우 만족합니다 전 매우 정겹고 편하게 소비자와 직접 이렇게 연결될 수 있다는 게 신기할 뿐입니다 이번 가게 접으면서 중고물품 새것도 있는데 싸게 내 놨더니 요것 저것 빠르게 나가네요 집에서 잠자는 물건들 빨리빨리 필요한 분들께 가게 되시길 정말 전 신이 났네요 전 팔아서 좋고 다른 분들 가까운 곳에서 사서 좋고 모두 모두 축복의 통로들 되시길 
당근마켓,초췌한나,2021년 7월 30일,1,,몇십번이나 여러날에 걸쳐서 인증번호 시도해 봤는데 계속 안오네요. 스팸번호로 추가된건 아닌지 T전화 사용중이라 혹시 안된건 아닌지 전원도 껐다 켜보고 별짓을 다했는데도 인증번호가 오지 않습니다ㅠㅠ 문의는 고유번호랑 닉네임 같이 넣어달라는데 애초에 가입을 못했는데 어떻게 문의를 하나요...,몇십번이나 여러날에 걸쳐서 인증번호 시도해 봤는데 계속 안오네요 스팸번호로 추가된건 아닌지 T전화 사용중이라 혹시 안된건 아닌지 전원도 껐다 켜보고 별짓을 다했는데도 인증번호가 오지 않습니다 문의는 고유번호랑 닉네임 같이 넣어달라는데 애초에 가입을 못했는데 어떻게 문의를 하나요,몇십 번이나 여러 날에 걸쳐서 인증번호 시도해 봤는데 계속 안 오네요 스팸번호로 추가된 건 아닌지 T 전화 사용 중이라 혹시 안된 건 아닌지 전원도 껐다 켜보고 별짓을 다했는데도 인증번호가 오지 않습니다 문의는 고유번호랑 닉네임같이 넣어달라는데 애초에 가입을 못했는데 어떻게 문의를 하나요
